site	location	review_title	review_date_original	review_rating	review_text
winedirect	GB	This company is a joke…	04 November 2018	Rated 1 out of 5 stars	This company is a joke as far i am concerned, it total rubbish. PLEASE DO NOT USE THEM.!!!! I ordered TWO bottles of Prosecco for my Nephews anniversary, along with a TWO bottle carrier and card. I went to check out and found ONE bottle of Prosecco and a bag for two, so i started again ordered TWO, paid to find there was one bottle a two bottle case being sent. i tried to find out how to cancel and it seems you cannot. i then received an e-mail thanking me for my order, i replied to this asking them to cancel as it was wrong. NO RESPONSE. i then phoned 5 - 6 times only to be told all operators are busy. i went onto the web site to direct chat with an adviser, the site said possible 30 min delay in response, yep! no joke their own web site will take up to 30 min to respond to a live chat. well i waited 45 min and gave up. Now they have the cheek to ask me to give them a good review. ARE YOU JOKING ME?????
winedirect	GB	Great service	03 November 2018	Rated 5 out of 5 stars	Very satisfied with the service - came a lot quicker than I expected.
winedirect	GB	Appalling company	02 November 2018	Rated 1 out of 5 stars	Appalling company. They took my payment immediately and wine never arrived. After four weeks of trying to contact them by phone which no one ever answers, you leave a message and no one calls you back, I emailed several times and again no response. Customer service is non-existent. I am currently trying to get a refund by the disputed transaction route with my credit card company. AVOID THIS COMPANY AT ALL COSTS!!
winedirect	GB	failure to deliver/non-existent communication - Avoid!!	01 November 2018	Rated 1 out of 5 stars	Bought six bottles of wine at over £200 weeks ago now — still not delivered whilst having emailed their CS team several times, and called continually. It seems they have no one on their CS line to answer calls, and they certainly don’t respond. Unsure what to do at this point other than report to trading standards. Avoid at all costs!
winedirect	GB	BEWARE; DELIVERY & SERVICE PROBLEMS	01 November 2018	Rated 2 out of 5 stars	"BEWARE:  DELIVERY AND CUST SERVICE PROBLEM.   My order confirmation showed the different billing v shipping address correctly.  However, when ParcelForce sent the tracker, they had the WRONG shipping address---my billing address instead.  I tried WineDirect x3008 number from their website four times and just got answering machine.  I left 2 v-mails to say, ""Stop.  Correct the mistake you made on the shipping address.""   NO ANSWER EVER.  So I called ParcelForce, who said they couldn't change it until delivery failed.I had to arrange somebody to wait at my billing address to receive the wine.  CRAZY. So DON'T order with winedirect if your billing and shipping address differ.  They will confirm it correctly, but ship it wrong.  DON'T expect any response from anybody if you have a problem.  NOBODY answers EVER.  However, I did receive the correct bottles per my order, and they were well packaged.  So OK if you don't have any issues.  You go forewarned!"
winedirect	GB	A matter for the police?	01 November 2018	Rated 2 out of 5 stars	I'm having the same problem as everyone else. I ordered at the start of October. They took my money and now, at the beginning of November, I have heard precisely nothing. Emails and calls go unanswered. Considering what everyone else is experiencing, I begin to think this is a police matter.
winedirect	GB	Longer deliver timeframe than expected	31 October 2018	Rated 3 out of 5 stars	My delivery was a gift and I chose this site over any other gift site specifically because of the FAQ stating a 1-3 day delivery time frame. After 6 days having not heard anything I sent an enquiry. A few days later my gift thankfully arrived, belated but appreciated, though no response to my query about the delay in the meantime. I actually DO think it’s an acceptable delivery time frame, however your FAQs need to reflect a true picture of how long it’s going to take so that customers can make an informed decision.
winedirect	GB	Same experience as others	29 October 2018	Rated 1 out of 5 stars	Same experience as others.  I ordered wine in early September.  They claimed it was dispatched on 25th September.  No evidence of any attempt to deliver.  Either it's a scam (shame on the posts from mock reviewers) or the company has ceased trading.  DO NOT USE UNDER ANY CIRCUMSTANCES.
winedirect	GB	Company may have closed.	29 October 2018	Rated 1 out of 5 stars	I ordered wine 13th Oct paid but have heard nothing since.  I have tried to follow up but cannot get hold of anyone at the website/store.  Looks like the company may have ceased trading.  Do not order from them!
winedirect	GB	This company appears to have gone broke!!	29 October 2018	Rated 1 out of 5 stars	This company appears to have gone to ground. I placed an order for 2 dozen bottle of wine on the 2nd October and after receiving nothing for 2 weeks I called on the 15th October and when I finally got through they told me that the wine will delivered on the 19th Oct. Still no wine. I have been calling for the past week and cannot get a response. Clearly they are in trouble. DO NOT ORDER WINE FROM THIS COMPANY, YOU WILL NEVER GET IT. They have my money and I don't like the chances of seeing it again.
winedirect	GB	Shocking service from start to finish	28 October 2018	Rated 1 out of 5 stars	Shocking service from start to finish. Tony Aubrew failed to email and call when promised several times. Delivery promises aslo failed with no information. Will not order again
winedirect	GB	I think this company has crashed	25 October 2018	Rated 1 out of 5 stars	Ordered 12 bottles on 21 Sept; 6 were delivered on 5 Oct, I called to chase the rest and was promised them by 11th Oct; they didn't come so I called again and eventually got through on 22nd after exchange of emails; promised balance again on Wed 24th, did not arrive; now no answer to emails, telephone never answered. Last company accounts (Nov 2017) filed at Companies House suggests big debts and insufficient trading income, so I suspect the chickens have now come home to roost.In short: DON'T PLACE AN ORDER WITH THEM - you put your money at risk.
winedirect	GB	AVOID	25 October 2018	Rated 1 out of 5 stars	Same story as many others, ordered wine, credit card charged, after several weeks wine not delivered, impossible to contact - doesn't answer the phone, no reply to emails, no reply to chats or web-site contact form. AVOID!
winedirect	GB	Don’t use this company - you won’t get your wine	25 October 2018	Rated 1 out of 5 stars	We only received part of our order - we were then told a pack of lies about when the rest would arrive. They are now uncontactable. If you’ve ordered, would suggest contacting your credit card company as you may need to make a claim to get your money back. Spread the word on social media - they are not to be trusted.
winedirect	GB	Don't use this company if you want to avoid disappointment	24 October 2018	Rated 1 out of 5 stars	I ordered wine from this company on 16th September.  I have tried numerous times to ring the company but phone goes straight through to voice mail and no-one calls you back.I have e-mailed several times and no response - I am at a loss for what to do as used a gift voucher to pay for the wine.Am really disappointed and annoyed at all the hassle!
winedirect	GB	WineDirect	23 October 2018	Rated 1 out of 5 stars	Today I received my bank statement which indicated that my card had been debited for the amount of £138.65 for two cases of wine ordered on 6 October.Sixteen days later, despite numerous ( fruitless) phone calls, messages …no confirmation, no updates, no wines!I have now contacted my bank in order to stop this transaction and only wish that I had the reviews on this website first!
winedirect	GB	order prepared and despatched promptly…	23 October 2018	Rated 5 out of 5 stars	order prepared and despatched promptly - looking forward to tasting!
winedirect	GB	Order delay but good corrective action	16 October 2018	Rated 2 out of 5 stars	"I wish I could give a more positive review, but I have only placed an order once, and experienced a problem with it. I ordered just a gift card, to be delivered to a friend for their birthday. I allowed two days for order processing and postage (which customer support have since confirmed is normally first class). A week after placing the order I found out that my friend had not received the gift card. I checked my email and noticed I had only had an acknowledgement of the order, and no further updates. I checked back on the website, and found the order status still showing as ""Acknowledged"". Once I e-mailed customer support, I got good service from Tony. The order was processed and dispatched immediately, and I received a email confirming the order was complete. I would give more stars for the customer service response, but the overall result was a gift card delivered a week late for my friend's birthday, which I cannot classify as ""an acceptable experience"".For WineDirect staff reading this review and wanting to check the details, the order number was 626258, and the order history still visible in my account on the website shows as 04/10/2018 Acknowledged; 11/10/2018: Dispatched."
winedirect	GB	They have had my money £138 for 15 days…	15 October 2018	Rated 1 out of 5 stars	They have had my money £138 for 15 days now, no wine.  Promises not kept.  It will be a miracle if the box of wine arrives this Wednesday as promised.  Didn't get the phone call back or email today.  Had to ring them. Appalling service. Will never use them again.
winedirect	GB	I ordered wine tokens as a Christmas…wine tokena	15 October 2018	Rated 5 out of 5 stars	I ordered wine tokens as a Christmas gift for my nephew. They arrived on time in good order. All in all a very good service thank you.
winedirect	GB	An abysmal lack of communications.	10 October 2018	Rated 2 out of 5 stars	An abysmal lack of communications...no acknowledgment of order, no response to phone calls, no response to messages left. How ca any company expect repeat business?
winedirect	AU	Our order has arrived on time and very…	10 October 2018	Rated 5 out of 5 stars	Our order has arrived on time and very much appreciated. We have used this service second time now and will be happy to consider Winedirect again. Happy to recommend this company.
winedirect	NZ	Terrible service - AVOID	09 October 2018	Rated 1 out of 5 stars	"Terrible service - AVOIDI ordered 6 bottles of Chardonnay for a birthday present and specifically stated that I did not want alternatives in case of product shortage. The order status sat as ""Order Acknowledged"" for weeks - I complained via email and left voicemails, but heard nothing back at all. A few days later and after I had written again to ask for a refund instead, suddenly I received an auto-email saying the wine had been dispatched and due for next day delivery. When I called the recipient to confirm, they said it had arrived but it was a mixture of red and white wine!!!!! I emailed the company to complain but (Unsuprisingly) never heard back!!! Terrible customer service and not the product I ordered! A first time customer that will never be back. I recommend using Fareham Wine Cellar instead - much much more reliable and reputable."
winedirect	MY	Delivery was very prompt	08 October 2018	Rated 5 out of 5 stars	Delivery was very prompt, with the goods being packaged very securely. Recommended.
winedirect	GB	Well done	08 October 2018	Rated 5 out of 5 stars	Very good selection and pricing but most importantly excellent delivery arrangements: quick and on time. Cannot fault the service.
winedirect	GB	Good customer service and fast delivery…	07 October 2018	Rated 5 out of 5 stars	Good customer service and fast delivery thank you.
winedirect	US	Delivery on time and as promised	06 October 2018	Rated 5 out of 5 stars	Delivery on time and as promised. Good job!
winedirect	GB	Terrible	06 October 2018	Rated 1 out of 5 stars	My order for a case of 6 bottles of Cloudy Bay Sauvignon Blanc was placed on 23rd August 2018, it was a present for my wife who had given birth the day before.When I hadn't had any update on the order 3 weeks later I called and spoke to an operative who apologised for the delay and said that it would be delivered by the middle of the next week at the latest and that an additional bottle would be included by way of compensation for the delay.When I still hadn't recieved the order or any further communication another week later I emailed and called again and finally managed to speak to the same operative. He advised that he would check with his supervisor and call me back within 20 minutes. I never received a call back.Finally received the order over 5 weeks late but disappointingly, without the additional bottle I was promised promised or any note of apology for the delay.During this time I tried calling numerous times but couldn't get through to anyone and never received any responses to emails.I have emailed them this commentary and they have not bothered to respond.
winedirect	KE	Horrible service	03 October 2018	Rated 1 out of 5 stars	Still waiting more than a week after ordering, no one answers the phone, I received a mail in response to my my email query saying I would receive a response “shortly”. Still waiting,!  Avoid!
winedirect	GB	Poor Customer Service	02 October 2018	Rated 1 out of 5 stars	Zero communication from customer service- phone or email. Have tried both. Nobody answers the phone or email. Zero information on delivery times- my order shows as acnkoweldged 8 days after I placed it. if people like what they do they obviously did not order the case of wine i did.
winedirect	GB	Excellent service and delivery	01 October 2018	Rated 5 out of 5 stars	I wanted a specific type of champagne to celebrate my wife's forthcoming birthday.  Her favourite is no longer stocked by the company I've been buying it from for years, but I found it to be supplied by WineDirect at a couple of pounds cheaper than when I last bought it.  The two bottles I ordered arrived very well packed within 3 days, I was advised at every stage of the progress of my order, the courier arrived 5 minutes earlier than his scheduled time and I could track him on his journey.  I could also leave instructions for him should I have needed to go out, or re-arrange the delivery.  This is the first time I've used WineDirect - it won't be the last.
winedirect	GB	Wine was quickly delivered	30 September 2018	Rated 5 out of 5 stars	Wine was quickly delivered - efficient service
winedirect	GB	Just too bad, AVOID	25 September 2018	Rated 1 out of 5 stars	"Decided against better judgement to order again. Some of the order came within a week. Rest took over a month. I emailed, but had not response. Luckily I had some direct emails rather than the one on the website from the last time, so I used those and got an answer ""I'll look into it"" but never heard another thing. Finally an email from APC overnight to say it is coming today, no advance warning, no time window. Last time I use this business."
winedirect	ID	Wine delivered on time (Anniversary…	25 September 2018	Rated 4 out of 5 stars	Wine delivered on time (Anniversary present). They received what was ordered and were happy with the content. They haven't tasted it all yet of course. Didn't get tracking information from delivery company, but as it arrived OK not a problem.
winedirect	SE	In my opinion your service has been…	23 September 2018	Rated 3 out of 5 stars	In my opinion your service has been variable. Most of the time your deliveries have been quick, but in two instances this past summer they have been very late about 4 weeks or so. Also, I have been a bit upset by an order of 6 bottles of burgundy some 2 months ago. It was recommended by professional winetasters, but actually tasted like ...., i have 4 bottles left, and I see no other way out than to pour them into the gutter. I see it as a onetime mistake on my part and will continue to order from you in the future. You have interesting wines.Kindest regards,Per Halberg
winedirect	GB	This company doesn't even deserve one star	21 September 2018	Rated 1 out of 5 stars	This company does not even deserve one star!I ordered my case of wine on 3rd September they took the payment out of my bank and I am still waiting, like all other reviews I also emailed and left messages via voicemail and on the online chat but not a peep from them. I did manage to actually get someone last Thursday only to be assured my wine would be delivered Monday.... Still waiting!!!!!
winedirect	GB	Absolutely awful - AVOID!!!	21 September 2018	Rated 1 out of 5 stars	No tracking number for order as promised, no delivery on date promised, emails ignored, just an absolutely shambolic company. Avoid at all costs. I have now asked my credit card company to intervene and get my money back (first time ever) and have placed a new order for the same wine (but cheaper) with the Fine Wine Company in Edinburgh.
winedirect	AU	Best online experience yet!	19 September 2018	Rated 5 out of 5 stars	The staff at WineDirect were absolutely wonderful through from helping with my order, to delivery. One of the boxes of wine that I had selected was out of stock, so to ensure I had wine for our event, they offered a much nicer box at no extra cost, with express shipping. I would recommend WineDirect to anyone as their customer service was fantastic, and I got my order well within the delivery time frame.
winedirect	GB	Having ordered wine to be delivered on…absolutely shocking	18 September 2018	Rated 1 out of 5 stars	Having ordered wine to be delivered on my dads birthday I was given all sorts of excuses about the courier company!! I had to go out and buy wine for my Dad so I didn’t face the embarrassment of not having a gift from him!! I tried calling, left voicemails but nobody had the decency to reply to me! Think twice about ordering from wine direct as they are charging a fortune for wine that was in stock yet they are incapable of sending out on time despite telling me it would be sent the day before to ensure delivery!!
winedirect	GB	You'll never get your wine	17 September 2018	Rated 1 out of 5 stars	As pervious people have pointed out:1. You order the wine2. It's not delivered3. You email them and chase and finally you get excuses about only part of the order being available4. You ask them to ship that part of the order5. You still recieve nothing6. They stop answering emails or the phone7. You raise a dispute with your credit card companySo - To try and help others, if you have paid over £100 on your credit card, search for 'Section 75 claim', if you've paid on your  credit card and it's under £100, look for 'chargeback scheme' on your credit card companies website.I think Wine Direct might have been made insolvent and 'Fermentation Wines' (the name on my email invoice) was mentioned and oddly, it's the same name as the Director - therefore God knows what dodgy dealings are going on.Either way, I would suggest you avoid as I've just contacted my credit card company for the first time EVER to get my money back.
winedirect	GB	As always the order was shipped and…	17 September 2018	Rated 5 out of 5 stars	As always the order was shipped and delivered efficiently.  Great service.
winedirect	GB	Best avoided	15 September 2018	Rated 2 out of 5 stars	Experienced all of the problems mentioned in the negative reviews below. Long delays before any wine received and wines missing- had to continually chase for missing wines and had to raise a section 75 dispute with my credit card company. Best avoided.
winedirect	GB	Do Not order wine from this company…	12 September 2018	Rated 1 out of 5 stars	Do Not order wine from this company under any circumstances Ordered and paid for Wine over 1 month ago.Nothing delivered yet,no response to phone calls or e mails.I can only assume they are in financial difficulties and can’t believe they are still accepting orders and taking money from people.Can only assume that anyone still receiving deliveries must have picked something which is physically in their stock.I have contacted my Bank and have asked them to investigate.
winedirect	GB	We are convinced this company is a con…	12 September 2018	Rated 1 out of 5 stars	We are convinced this company is a con and the only positive reviews on here must be from the owners. We ordered wine in July as a thank you present. Still no delivery and we're well into September.  Company won't respond to emails or phone calls. Trading standards or small claims court are probably our next port of call.
winedirect	GB	Excellent service	12 September 2018	Rated 5 out of 5 stars	Excellent service! Placed my order Monday evening and received on Wednesday afternoon, my order was correct and in perfect condition.  Seen a lot of bad reviews they have clearly have sorted things out . Will visit again .
winedirect	GB	Completely hassle free from start to…sisters birthday	10 September 2018	Rated 5 out of 5 stars	Completely hassle free from start to finish. My sister is delighted with her wine.
winedirect	GB	The wine arrived within a week	03 September 2018	Rated 5 out of 5 stars	The wine arrived within a week, overnight courier with text updates and 2 hour delivery window, well packaged and delicious wine at a competitive price. What more can you ask for?
winedirect	GB	Like many reviews before us we placed…	31 August 2018	Rated 1 out of 5 stars	Like many reviews before us we placed an order for wine from this company on 7th August. They instantly took the payment from our account and to date no delivery or corrrespondance has been made. On the rare occasion we were able to get through to a human rather than voice mail !! We were assured that the delivery was on its way, this was in fact not the case. Very disappointed. Still waiting!!!
winedirect	GB	Ordered wine on the 11th of July	30 August 2018	Rated 1 out of 5 stars	Ordered wine on the 11th of July, still not received the wine ,neither had a really to my emails or calls
winedirect	GB	Use their services at your peril	29 August 2018	Rated 1 out of 5 stars	Have some excellent wines and offer good price reductions from time to time. However, when they fail to deliver - as they frequently seem to do - their customer care service is the pits! Nothing is forthcoming from them in the way of information or explanation - you have to do all the chasing down. and even then getting any kind of response is akin to getting blood from out of a stone! Reluctantly, having used them for some while, I have come to the conclusion that they do not deserve to continue trading.
winedirect	GB	Top service again	29 August 2018	Rated 5 out of 5 stars	Top service again. Placed order for 12 wines last week. Had an email a few hours later saying some were due inbthis week but offered part shipment of available (8 bottles) for the BH weekend which was appreciated. Fantastic wine and fantastic service.
winedirect	GB	AVOID	28 August 2018	Rated 1 out of 5 stars	Ordered wine over 10 days ago - heard nothing. think I've been turned over
winedirect	GB	Excellent service from Winedirect....	28 August 2018	Rated 5 out of 5 stars	Excellent service from Winedirect..... fantastic recyclable packaging ensures safe transit.... choices to keep same make and vintage or allow alternatives.... so far so good!
winedirect	GB	Copied from the person before as…	28 August 2018	Rated 1 out of 5 stars	Copied from the person before as IDENTICAL ISSUES.The only reason I have scored one star is that I can’t comment without a star score. Don’t ever use this company. They take your money and do nothing. They don’t respond to e-mail or to ‘phone enquiries and I can only assume that the positive markings are from their friends and family. I am going back to my card company for a refund! It is appalling that they can still trade.
winedirect	GB	!!! Avoid like Bowel Cancer !!!	27 August 2018	Rated 1 out of 5 stars	Primitive scam operation. step 1: you order wine and pay on your credit card, money gets deducted next day.step 2: wine is not delivered on said date. step 3. correspondence is next to impossible and phone lines either don't work or engaged, don't respond to email.Step 4. you finally get something back about 'difficulty to source' said wines + promise of wines being delivered laterStep 5. wines are not delivered again. Have to claim back funds from bank.Throughout the whole process they will be very vague with specifics and details, they will avoid emails, as they know you will raise a dispute with the CC company.
winedirect	GB	Buy your wine from somewhere else...	26 August 2018	Rated 1 out of 5 stars	The only reason I have scored one star is that I can’t comment without a star score. Don’t ever use this company. They take your money and do nothing. They don’t respond to e-mail or to ‘phone enquiries and I can only assume that the positive markings are from their friends and family. I am going back to my card company for a refund, will be hitting social media to warn the world and contacting Trading Standards. It is appalling that they can still trade.
winedirect	GB	Nothing short of a scam.	24 August 2018	Rated 1 out of 5 stars	Nothing short of a scam, website looks good and professional, money taken immediately, then you fine out you have no one to talk too, don't bother sending an email as there will be no reply. Just try calling before you order and that will set off the alarm bells, well at least I've learnt from this and hopefully will recover my money from my credit card.Wished I read the reviews, schoolboy error.
