site	location	review_title	review_date_original	review_rating	review_text
winedirect	GB	JOKE COMPANY AVOID AT ALL COSTS	14 February 2018	Rated 1 out of 5 stars	The worst company i have ever had the misfortune to deal, customer service is a guy called tony who sounds like he is sitting in a garden shed, and is completely useless, i ordered 6 bottle of wine on 2 wks ago now , i have received just 2, sent 2 emails which are ignored,spoke to hapless tony who told me 3 different dates my wine was going to be delivered and never turned up, this company needs looking into byBBC watchdog, the also takeyour money before the goods are dispatched, so no chance of getting that back either,  Thanks for the reply back Dan, glad to know that you have more than one person on customer service, yes tony said mywine is coming today, its now 4.15 and ive received nothing that has my wine has been sent , what a surprise, you said you think you know who i am who has made the order, so why don't you sort it out. o n 616215
winedirect	GB	Wind Direct Feedback	12 February 2018	Rated 5 out of 5 stars	Ive been buying from Wine Direct for more than 10 years now and rarely had an issue with delivery. I was made aware of a delay with my recent order and provided regular updates until the order was completed. I have always found the team extremely helpful and the wine prices excellent and hugely competitive on a very wide range of wines. Keep up the great work and superb prices. Best regards. Luke
winedirect	GB	Avoid	12 February 2018	Rated 1 out of 5 stars	Avoid! They took the money before the wine was ready to ship, then delayed shipment for weeks with little correspondence. They often do not answer the phone and do not respond to emails. Even the shipping tracking number was invalid. We were very surprised to get our wine, and still feel like we we scammed. We did get our wine in the end but only after we started a dispute with the credit card. (order ref: Wheeler)
winedirect	AU	Great selection and the delivery was …	11 February 2018	Rated 5 out of 5 stars	Great selection and the delivery was quick and on time..thank you..
winedirect	GB	Great service from start to finish	11 February 2018	Rated 5 out of 5 stars	Great value wine.  Lots of emails with each stage of delivery so I knew exactly when to expect delivery.  Securely packaged to minimise damage to the bottles.
winedirect	GB	Good but...	11 February 2018	Rated 3 out of 5 stars	Find ordering from winedirect mostly good but not consistently good  My first order (last year) I had to phone a couple of times to check on progress.  Then a couple of smooth quick deliveries but the most recent delivery (after getting no more than an acknowledgement of my order) required me to send an online query to winedirect after a week, (which wasn’t responded to) followed by a chase up call where a nice man confirmed everything was planned for dispatch (and the updating of my order status was simply a clerical error).  Excellent wines at competitive prices but my request to winedirect is to please keep building customer confidence and be more proactive at keeping your customers updated. Thanks
winedirect	GB	wine not arrived- avoid this company	08 February 2018	Rated 1 out of 5 stars	Wine direct took 10 days, and nothing has happened with my order. I spoke to a member of  staff after a week, who assured me the order would be here on time. Unsurprisingly, it didn't arrive.
winedirect	GB	The wine I ordered came when I expected …	06 February 2018	Rated 5 out of 5 stars	The wine I ordered came when I expected it and tasted as good as I was expecting
winedirect	GB	Christmas wine	05 February 2018	Rated 2 out of 5 stars	I ordered wine to send out for Christmas on 6th December and received it on 22nd December. I asked for information about a delivery day numerous times via phone and email, only to receive the same answer 'We will get back to you', which of course none did. I ended up having to buy other wine (from Majestic), in order to send it in time.Plus, a case received was of a completely different wine. I phoned up in early January to say this, and nothing happened. I phoned again the other day and I received the correct wine within the day. If only that had happened for Christmas...I wished there had been some kind of advert on the website to say that the company was in the middle of changing warehouse and there would have been delays with the orders. I don't think I will use the website again.
winedirect	GB	7 day delivery	05 February 2018	Rated 3 out of 5 stars	7 day delivery - might have been quicker - appeared to sit in transport hub from Friday night, delivered 8am Monday morning - before the Trustpilot email arrived!
winedirect	AU	Poor Partial Delivery	04 February 2018	Rated 3 out of 5 stars	I ordered 2 cases of wine to be delivered for Christmas, each received half of the order in time. One received the second half mid-January the other one was cancelled and my money refunded without telling me. I did tick the box that alternatives were acceptable, but none were provided.
winedirect	GB	Order process was easy and delivered as promised	04 February 2018	Rated 4 out of 5 stars	Order process was easy and I was kept up to date with delivery . Delivered on the day they said but later than noted, not a big issue so overall very happy.
winedirect	GB	Having read other reviews I was a …	04 February 2018	Rated 5 out of 5 stars	Having read other reviews I was a little nervous when I placed my first order.  However, I can only judge as I found and every aspect from the friendly website to good comms to the quick delivery time was excellent - oh and the wine was delicious..!
winedirect	GB	Satisfied with the on time delivery	02 February 2018	Rated 5 out of 5 stars	
winedirect	GB	Order placed on 24th January for 6 …	30 January 2018	Rated 4 out of 5 stars	Order placed on 24th January for 6 bottles and delivered safely by DPD on Friday 26th January.  I can only speak for my experience but also used Winedirect on 3 or 4 previous occasions and never any problem receiving my wines within around a week of order placement.  There was one occasion where a single wine was unavailable and that bottle was refunded without issue.  In fairness the previous orders were more than 12 months ago and it seems that Winedirect have had some issues coping with volume of business ahead of Christmas.  I hope that this is properly addressed for all those with genuine cause for complaint,  but I do not have an impression that Winedirect are deliberately dishonest or in any way fraudulent in their dealings.
winedirect	GB	Terrible website with no accountability …	26 January 2018	Rated 1 out of 5 stars	Terrible website with no accountability and a non-existent customer service. Ordered 6 bottles of wine more than a week ago and paid for all 6 bottles. Expected delivery time is 1-2 days but the order never came. Submitted an online form on Wine Direct’s website, emailed them four times across the week and called them repeatedly but have not received any updates. Will be taking further action if the company still refuses to get back to me
winedirect	GB	Always had excellent service	23 January 2018	Rated 5 out of 5 stars	Always had excellent service from winedirect, and some lovely wines at very good prices.
winedirect	GB	If you don't want to have problems …	23 January 2018	Rated 1 out of 5 stars	If you don't want to have problems calling your credit card to cancel your order... don't order from them!!!there is no client service (Always voicemail) don't deliver the orders don't reply e-mails Completely out of order... don't even think they exist!!
winedirect	ZA	Unacceptable	23 January 2018	Rated 1 out of 5 stars	Unfortunately, this is not a Company I would like to order from in the future. The mark of a well run Company is how they respond to issues and provide adequate communication to their clients. Wine Direct clearly has no idea how to provide acceptable Customer Service.
winedirect	FI	Total SCAM	23 January 2018	Rated 1 out of 5 stars	Total crap, don't order anything from them! Made my order on 9th of December with international delivery that they advertised on their website. There was no info about any delivery delays for the items that I ordered and I was unable to get any response to my calls/emails/chat requests. They also promise on their site to contact if the delivery time is expected to be delayed more than 14 days. That never happened.Then suddenly on 5th of January I received APC overnight tracking code for domestic deliveries that is not valid for international deliveries without any further explanation etc.Now it's 23rd of January and I have tried to get in to touch with them multiple times in different channels without any luck. Now I'll call to my credit card company and report the scam.Don't order anything from them unless you want to play Russian roulette with your money and nerves.
winedirect	GB	Great service !!	22 January 2018	Rated 5 out of 5 stars	
winedirect	GB	Had a dispatched e mail but haven’t had …	22 January 2018	Rated 3 out of 5 stars	Had a dispatched e mail but haven’t had a delivery yet.
winedirect	SE	Qiuck response to email	21 January 2018	Rated 5 out of 5 stars	Qiuck response to email, and fast delivery
winedirect	GB	Fantastic service	20 January 2018	Rated 5 out of 5 stars	Fantastic service, wine delivered next day,
winedirect	GB	Unexplained delay for delivery, unacceptable customer service	19 January 2018	Rated 1 out of 5 stars	Unexplained delay for delivery. Unacceptable customer service, no reply to email, unanswered call. If I can rate it as 0 star, I would have done it. Absolutely a waste of time.
winedirect	AU	Great service	17 January 2018	Rated 5 out of 5 stars	Your website was easy to use. The purchase was straightforward. Great selection of wines. My relative received the delivery of the wine at the time you told me it would arrive. My relative was very pleased with the present and it arrived safely. Very happy with your service and level of communication about the delivery. All communication was comprehensive. Reassuring as I am in Australia sending a present to the UK. Thanks. I will use your service again.
winedirect	GB	Still hideous	17 January 2018	Rated 1 out of 5 stars	Updating from our previous post... it has arrived at the point now where our emails and calls are willfully ignored (but guests from our wedding have their emails answered). To top it off, Tony - customer services - has blocked calls from my mobile phone. The wedding was on 28th October - we still don't have all of the wine that our guests gifted to us and it sadly looks like we're never going to get it.
winedirect	GB	Missing delivery now fixed	16 January 2018	Rated 3 out of 5 stars	Feb: 2018:Footnote to earlier comments - owners of WD are working hard to restore customer confidence by clearing rhe backlog of unfulfilled orders - in my case with a personal delivery by one of the owners.  Given what I've now experiencd, I hope that they can get back on track for all their customers - starting with proper communications and replies to messages/emails.  So, thank you WD, all sorted.---------------------------------------------Jan 2018:I'm really disappointed that I have to add my sense of despair with winedirect to the comments that have been left by so many other people.  Order received second week in January but sadly missing several bottles -  emails and phone messages have failed to get any feedback from the company so I fear that I have been ripped off for about £40 worth of wine that was ordered but is unlikely to be received.Avoid.
winedirect	GB	One star for this company is being …Awful awful company	16 January 2018	Rated 1 out of 5 stars	One star for this company is being generous!! They are the worst company I’ve ever had the misfortune to deal with! Ordered wine 30th November.. missing 11 bottles still. You NEVER get through to customer service. No one ever returns your call. Emails are only answered very occasionally. We have been promised delivery several times... nothing has appeared. They are con merchants in my opinion. I will now instruct my credit card company to claim money back! My advice to anyone thinking about ordering from them... DON’T!!!Added 8/2/18Also don’t fall for the ‘despatched’ email! I imagine that is because my credit card company has clawed money back. Bunch of charlatans!!!Jeez never use this company.
winedirect	GB	First time purchase	16 January 2018	Rated 5 out of 5 stars	First time purchase, service was great and arrived in just a few days. Thought it would take longer! Wine is excellent and reminds me of Venice which is where we first tried it. Will definitely use again.
winedirect	GB	Customer service slow	16 January 2018	Rated 3 out of 5 stars	Customer service slow, I emailed on the 11th and got a reply on the 15th, phoned many times and got an answering machine, never managed to get through to anyone. Ordered on the 5th Jan arrived on the 15th Jan. Got an email from DPD on the 13th advising me the wine would be delivered.  This could all be due to a very busy Christmas trading?
winedirect	GB	Do not use this company.	15 January 2018	Rated 1 out of 5 stars	do not use this company.I ordered my wine on December 11th for Christmas and never received it. today is January 15th and still nothing. I have phoned this company 12 times and sent 3 emails and not one single reply.when you phone this company you can NEVER get speaking to anyone that works for Wine Direct only an overflow team who cant do anything.I cannot get my money back and am now taking Legal action against this company
winedirect	GB	I buy from a variety of sellers......	13 January 2018	Rated 3 out of 5 stars	I buy from a variety of sellers. Winedirect are by far the worst to deal with from a customer care perspective. It is almost impossible to get through to them by phone. You end up leaving endless messages and sending many emails before you get a reply. I have not had any issues with the wine when it’s been delivered, but the level of communication is awful. If you order from these guys, don’t expect quick delivery or a quick response to any queries.
winedirect	GB	DO NOT USE THIS COMPANY	13 January 2018	Rated 1 out of 5 stars	Wish I had read the reviews here before ordering because clearly Winedirect has not improved their service at all.Ordered two bottles of champagne on 6th January. Two bottles turned up but, despite me checking the boxes saying no substitutes, they have sent me a completely different vintage. Tried to call them on the phone 3 times and was only ever able to leave a voicemail. Also contacted them via their website. Nobody has come back to me. Have now raised a dispute with the credit card company. If Winedirect want their champagne back they are going to have to come and collect it because I am not paying the return postage.
winedirect	GB	Good service	13 January 2018	Rated 4 out of 5 stars	Ordered Saturday, arrived Wednesday, with clear communication in between.  No complaints.
winedirect	GB	Not satisfied	13 January 2018	Rated 3 out of 5 stars	Not very satisfied. Placed an order but decided to cancel my choice within about an hour, in favour of some different wines. No option to cancel on the website so sent a online message. 4 days later and still no response. Tried their phone 5 times but no one ever answers or returns your call. Wine arrived promptly and I debated whether to reject the DPD delivery but decided I would probably never get my money back so kept both orders. Meaning an additional spend of £60. Very frustrating. I would source your wine somewhere else.
winedirect	GB	Better communication needed.	12 January 2018	Rated 3 out of 5 stars	What I found a bit disappointing was that they didn’t have the wine in stock- but it wasn’t until I got in contact to get an ETA for the delivery that someone got in contact with me regarding the lack of stock and seeing if I was happy with the suggested replacement. I checked my junk emailed regularly also and there was no mail in there regarding my order. I wouldn’t have minded but payment had been taken and the money had been withdrawn from my bank account and I was just not informed of anythingOnce they had made contact after I got in contact and made the substitution delivery was extremely quick and the product I received is also very good. I work in wine also and appreciate how these things happen but communication quickly will help you solve a lot of issues before they arise.
winedirect	GB	I think they are a scam	12 January 2018	Rated 1 out of 5 stars	I think they are a scam. never received parcel!
winedirect	GB	Is this company a scam or fraudulently trading ?	11 January 2018	Rated 1 out of 5 stars	Ordered wine and paid in good faith on 27/11/2017.Cash taken and then spurious delivery postcode appeared on my delivery confirmation.No delivery and despite one email confirmation the matter would be resolved subsequent complete radio silence. Multiple written requests for an answer unanswered and numerous attempts to contact by phone met with reference to an answer machine..DO NOT ORDER WINE FROM THIS COMPANY
winedirect	GB	Never answered a single email !	11 January 2018	Rated 1 out of 5 stars	Never answered a single email !Ordered wine on 5th December only turned up on the 23rd with a bottle missing from the order, I have had no refund and the customer services number rang out when I called.....
winedirect	GB	NO DELIVERY, NO APOLOGY TERRIBLE!	10 January 2018	Rated 1 out of 5 stars	Wine ordered on 21st Dec has still not arrived by 10th January. Belated Christmas gift gone very wrong! Despite five calls and sitting in the customer service 'overflow' I have still not received any customer service advice or even a call back, not to mention the fact I am severly out of pocket and very embaressed that my Christmas gift has never arrived. Do not use this companty!
winedirect	GB	Great supplier of wine online	09 January 2018	Rated 5 out of 5 stars	Although a bit slower on delivery and communication, I understand that it's been a very busy time over the Christmas and New Years period so not a big issue. Still came within a week which is great.Great selection of wine, good prices, and importantly they use a great logistics supplier for the final delivery (DPD).
winedirect	GB	AVOID LIKE THE PLAGUE !!!!!!!	08 January 2018	Rated 1 out of 5 stars	I purchased a box of 12 bottles of wine on the 12th Dec. 6 bottles arrived on the 27th December having charged me for the full 12. I have contacted Wine Direct 4 times in the last week to either receive my outstanding wine or a refund. Whatever department you call be it Customer Service or Accounts they default to ' this is the overflow desk someone shall contact you asap' and they never do. This is the worst Wine company I have ever had the dis pleasure of contacting please DONT TOUCH WITH A BARGEPOLE.First and most certainly the last time I shall be dealing with them.
winedirect	GB	Good service	07 January 2018	Rated 5 out of 5 stars	easy to order, good communication and arrived well packaged, on time. Would recommend and use again.
winedirect	GB	No customer service	05 January 2018	Rated 1 out of 5 stars	Just before Christmas I received an order with the wrong vintage, despite specifying that I would not accept substitutes.  Winedirect has ignored my phone messages (I can't even get through to customer service) and emails
winedirect	AU	The worst on-line purchase of my life.	04 January 2018	Rated 1 out of 5 stars	I ordered wine and paid for it in October 2017 for delivery just prior to Christmas. Now January 5th and still no wine delivered. Andrew Birtley was the focal point for my order he will not reply to emails or accept international calls. If you are thinking of using this company just save yourself the effort and just flush your money down the toilet.
winedirect	GB	Pleased	04 January 2018	Rated 5 out of 5 stars	Good service, delivery time was fine.
winedirect	NZ	Bought some wine for my sister's …	04 January 2018	Rated 5 out of 5 stars	Bought some wine for my sister's birthday, i live in NZ so tricky to get stuff to her but Wine Direct got it delivered bang on time and she loved the wine - so cheers guys!
winedirect	GB	Good service	03 January 2018	Rated 5 out of 5 stars	
winedirect	GB	Never again	03 January 2018	Rated 1 out of 5 stars	I ordered a case if wine on the 1st of December as a Xmas present, the money was taken out of my bank account on the 4th of December, after e-mailing and a phone call to them it is now 3rd of January and still no wine
winedirect	IE	Highly recommend the Team and …	02 January 2018	Rated 5 out of 5 stars	Highly recommend the Team and WineDirect. Excellent service, extremely efficient and fantastic value!
winedirect	AE	Good selection of wines and reasonable …	02 January 2018	Rated 1 out of 5 stars	Good selection of wines and reasonable pricesUnfortunately packaging was inadequate and two bottles were broken on delivery and one bottle had been substituted despite requesting this would not be acceptable on the order,Update - having posted this two weeks ago I am still trying to contact customer service who do not respond to emails or calls. Escalating the matter to BBB as clearly the operation is broken or a scam.
winedirect	AU	Very satisfied with the service and …	02 January 2018	Rated 5 out of 5 stars	Very satisfied with the service and quality of the wine. The wine was delivered within 2 or 3 days of placing the order despite the website saying that it would not be delivered until after 5 January. This was much appreciated.
winedirect	US	I ordered the wine just going by …	31 December 2017	Rated 5 out of 5 stars	I ordered the wine just going by instinct, a Chilean Carmeniere. I live in the USA and was sending it to my son in London.  The delivery was on time and efficient, and my son said the wine is excellent!This is the second time I have used Winedirect, and will not use any other company for my gifts to the uk in the future.Betty Joseph
winedirect	GB	Jordan's South African wine	31 December 2017	Rated 4 out of 5 stars	Had been trying to buy this particular South African wine everywhere with no luck until I tried Wine Direct and then - bingo! Not only did they stock it but it was delivered within a couple of days of placing the order and just in time for our Christmas table! A fine wine reasonably priced.
winedirect	AU	Super quick delivery at a very busy …	31 December 2017	Rated 5 out of 5 stars	Super quick delivery at a very busy time around Christmas. Massively pleased and never had an issue buying from wine direct
winedirect	GB	Excellent wine and good service	30 December 2017	Rated 4 out of 5 stars	
winedirect	GB	The worst online supplier I've ever encountered!	29 December 2017	Rated 1 out of 5 stars	I totally agree with everyone who has given Wine Direct one star. But One Star (= Poor) doesn’t begin to describe WD’s service accurately. It should be possible to give Zero Stars (= Dreadful).On December 12 I ordered 12 bottles of wine from this company. On December 14 I received an email saying my order was ‘processing’. Since then I have been unable to contact the company, either by voicemail (they never answer the telephone) or by email. The wine was a Christmas present: on December 21 I ordered a replacement crate from Laithwaites, who guaranteed Christmas delivery; they delivered on December 23. No problems. Excellent service. I am now in the process of reclaiming my WD credit card payment, under S. 75 of the Consumer Credit Act 1974. My credit card provider is being helpful.Wine Direct appears to be the most incompetent, useless outfit I ever dealt with. How they can continue trading is a mystery.
winedirect	GB	This is the worst company I have had …	28 December 2017	Rated 1 out of 5 stars	"This is the worst company I have had the misfortune to purchase from.  Took immediate payment, did not acknowledge order, responded (eventually) to my chasing with a promise to deliver then didn't.  Have since not responded to 3 emails and 1 phone call to so-called ""customer services"".  Have filed a complaint with my credit card company.  I have been  buying wine on-line for 15yrs and have never had such an appalling experience.  Never again.  For your own sanity heed my advice !"
winedirect	GB	DO NOT USE THIS COMPANY!!!	28 December 2017	Rated 1 out of 5 stars	I wish I had the previous bad reviews. This company is terrible, they lie on the phone saying your order is on the way, but it’s not. It’s now the 28th December and our Xmas wine has not been delivered, despite all the guarantees. We ordered a substantial amount, as a consequence I feel so cheated and such an idiot for using them. I’m beginning to wonder whether it’s a scam.
winedirect	GB	AVOID AT ALL COSTS - CUSTOMER SERVICES WILLING TO LIE!	28 December 2017	Rated 1 out of 5 stars	Ordered wine for Christmas on 10th December for guaranteed Christmas delivery. Payment promptly taken on the 10th December. Phoned twice last week and was told my delivery was guaranteed by Christmas. Was also told that all the office staff were in the warehouse ensuring orders were delivered by Christmas. We are now post Christmas and still have not got my guaranteed wine. I have tried getting in touch my phone, email and their IM service and have got no reply. Avoid this company as their customer service is abysmal.....lying to customers.....seriously.
