site	location	review_title	review_date_original	review_rating	review_text
winedirect	GB	Don't even deserve the one star to be…	19 May 2023	Rated 1 out of 5 stars	Don't even deserve the one star to be honest. I placed an order back in March and have still not received it. I have spoken to customer services on a couple of occasions and been assured that my wine would be arriving shortly, the last time I spoke with them was 4 weeks ago, I was told my wine was in the UK and had cleared customs...still no wine and I am now unable to contact them. No one answers the telephone, I have left voicemail messages, no one has got back to me and I have sent emails and no one has replied. I am beginning to wonder if this company has shut down.They have had my money since March, I have been extremely patient, however now my patience has run dry and the fact that no one is communicating with me and I cannot get in touch with the company is just making matters worse.I will NEVER use them again, and suggest you avoid at all costs.APPALLING SERVICE
winedirect	GB	THIS COMPANY IS A SCAM	05 July 2023	Rated 1 out of 5 stars	"THIS IS A SCAM - DO NOT ORDER Their name is also Just in Cases. I ordered paid immediately and the order did not come. I queried it after a few weeks and got 1 reply to say it was becuase it was out of the country. I emailed again, no reply. so I emailed again asking for a refund. No reply. I left a phone message as there is no way of contacting them . No response.I contacted my bank, sent the receipt and proof of the lack of communication. My bank refunded the amount to my card for me. I am contacting Companies House to report them and the Financial Omnubusman. Hopefully so no-one else will get caught in the same net.This is on Companies House too.  	Termination of appointment of Paula Rehberg as a director on 26 May 2023 Company Name: WINE WAREHOUSE LIMITEDCompany Number: 11672931The names of the Companies are:Wine WarehouseWine DirectJust in Cases. Please note there is no S on the end, as this is another company not related. It is the same address if you look it up as Just in CASE(S) . There is one other company Just in Case . No S, which is okay to use."
winedirect	GB	Out of business?	23 January 2019	Rated 1 out of 5 stars	Avoid this lot at all costs.We ordered expensive wines for Xmas, order was acknowledged then NOTHING.They don’t respond to emails or voice messages.Bank has refunded card charges and is now investigating the fraud.
winedirect	GB	Poor Customer Service	05 May 2023	Rated 1 out of 5 stars	I've used Wine Direct since 2012 and generally found them good. Unfortunately, and based on other reviews, they seem to have problems. Problems that may be beyond their control but they don't reply, so I don't know.I ordered 6 bottles in Feb. and received 5. I was told the 6th was stuck in transport and should be with me soon. Over 8-weeks later, no word. I have mailed and called several times but no replies. It is a shame but I will never use them again out of principle.I'd suggest you seek wine from more reliable firms.
winedirect	GB	Disappointing lack of customer service	14 June 2023	Rated 1 out of 5 stars	Unfortunately, I have had a similar experience to other reviewers. I placed an order mid-June, and my account changed to 'pending' the following day. After no further updates for a couple of weeks, and no response to my emails requesting an update, I rang them, and actually managed to speak to someone who told me that my order was held up in customs and was scheduled for delivery the following week. Perfectly plausible. She also claimed that they were having email problems, and hadn't received my enquiries. However, another two weeks on, I've still heard nothing and can get no response from email, telephone or via the Facebook page. I am, however, getting regular marketing emails! I see from responses to other reviews that someone is responding and that there is new management, and can only hope my order will eventually be sorted out. I quite understand that it can take time for an order to arrive - it's the complete lack of communication that is really disappointing, and worrying considering some of the other reviews.
winedirect	GB	No correspondence despite taking money	19 January 2019	Rated 1 out of 5 stars	I am afraid I have called this company over 20 times to try and actually speak to somebody regarding my order. No answer. No answer to my emails or chat message requests. No indication as to delivery. They had a minimum order of 6 bottles which came into well over 100 pounds. The next step is calling my bank and getting my money refunded. Worse company I’ve had to deal with in U.K.. I won’t order from them again!.
winedirect	GB	TERRIBLE!	19 January 2019	Rated 1 out of 5 stars	"Same experience as others. Ordered on the 10th January, money taken same day, order status still says ""Acknowledged"". Sent chat messages, emails and tried to call them but no response, TERRIBLE SERVICE!"
winedirect	GB	Im so very angry as this is the first…	21 January 2019	Rated 1 out of 5 stars	Im so very angry as this is the first time we have used this company and it only came about that my husband left his job and it was their gift to him - they have taken our voucher and a small amount off his card and this was all before christmas and we have no wine and no communication - I have emailed 3 times, my husband has emailed once and I have spent the last 2 weeks calling every other day! Daylight robbery is what it is! Absolutely awful awful company and I will NEVER use them again and will be advising every one I know to stay clear also. I am sad for my husbands old company as they have lost their money - shocking!!
winedirect	GB	Ordered wine 2nd April 47 days later still no wine.	17 May 2023	Rated 1 out of 5 stars	Ordered wine 2nd April for expected delivery on circa the 5th April as this was in stock, noted order pending had not changed so emailed again on the 5th April. Order never arrived. Emailed for an update on the 11th April saying to cancel the order and no reply but i did have a phone call. The lady (Helen Bryant i assume) said it was out of stock and it was my fault as i should have seen this. I actually had a screen shot and there was no out of stock message.Agreed to leave it until stock came in on the 2nd May and it would be straight out to me.Here we are now the 15th May and no delivery, emailed them to say i want a refund and again no contact. Now 47 days since ordering so i have filled a complaint to the bank to reverse the transaction. If i have no joy there i will instruct a Debt Collection Agency who take no prisoners when used in the past with a 100% success rate for our company. I will be driving past their place in two weeks time so may call in for a chat with them too.
winedirect	GB	I wish I had read the reviews prior to…	19 April 2023	Rated 1 out of 5 stars	I wish I had read the reviews prior to placing my order. Order placed 25/03/23 and confirmation received. On 01/04/23 I contacted them via email to ask where my order was - no response. Phoned them to ask and was told they are very busy and would get round to contacting me. Said the wine was out of stock - they didn’t say that when I placed the order. I was told they were expecting it that week and it should be despatched and received Easter Saturday (8 April).It is now 19/04/23 and I’ve heard nothing. No email, no phone call, no apology. The order still says pending. What a shambles. I hope Wine Direct read their reviews and get their backsides into motion. If you give poor service, you don’t get repeat custom and your business won’t survive. Is this business poorly managed or is it a scam?  I definitely don’t recommend this business.19/95/23 update - still no communication, or wine received.  Can’t get through on the phone.  Now I’ve referred it to my credit card company.
winedirect	GB	Order not Delivered, Emails not Answered	26 July 2023	Rated 1 out of 5 stars	Order placed for delivery in time for a birthday on 30th June - money taken, no communication, eventually got a reply saying waiting for stock - then nothing - no reply to emails 4 weeks after the order
winedirect	GB	Avoid! This is a scam company now.	17 July 2023	Rated 1 out of 5 stars	Expensive wine ordered and no delivery! Emails bounce and no answer by phone. It’s a scam company now. Avoid avoid avoid!
winedirect	GB	Very poor communication and let down by the company	19 December 2022	Rated 1 out of 5 stars	Ordered 4 wines for Christmas at beginning of December - and money taken (of course). Only when received invoice did I see the statements, replace or different vintage. These wines were on a list my husband gave so not replacements would do. I emailed and this was acknowledged. Chased delivery 2 x by email - no response. Called on 19th to be told the most important wine was out of stock but the order was ready to be sent with a replacement! The wine I wanted wasn't due in until the new year and no date. I had also ordered a personalised wine box to put these wines in that is obviously non returnable. I had to cancel the wine order and now have an empty personalised box.  The staff are good when you speak to them but really the website needs real improvement if this company are to survive in a  crowded market place in poor economic times. Those with the best service will survive. Just tell us if its out of stick and keep customers informed if you want to keep them. Now waiting for a full refund - 5 days later nothing so how long????
winedirect	GB	If only I'd checked out Wine Direct on Trustpilot first!	25 January 2019	Rated 1 out of 5 stars	"I unwittingly stumbled into this hapless (and seemingly dishonest) company a week ago. On 17 January 2019, I was searching for a case of particular wine via Google, and the ""Just-in-Cases/Wine Direct"" web sites came up showing it in stock. I went ahead and placed an order, and paid (thankfully) by MasterCard. I only wish that I had checked them out on Trustpilot before doing so. Like other victims, the money was taken, but no order acknowledgement was forthcoming. I tried phoning them the next day, but like others, could not speak to anybody. No response to messages left on their voicemail, or to email. The web site was closed down over the weekend (apparently undergoing maintenance!!). I began to suspect that the company had gone bust. This was confirmed when the web site came back up again on 25 January, displaying a statement by administrators. They had indeed ceased trading.The matter of compensation is now in the hands of the credit card company.Further update on 13 Feb 2019:Pleased to say that my Credit Card company has made a full refund to my account."
winedirect	GB	Ordered on 21/12/18	22 January 2019	Rated 1 out of 5 stars	Ordered on 21/12/18, 6 bottles of wine, they took the payment twice, but only delivered 6 botttles even though they took payment for 12. Have text chat, emailed and phoned several times with no replies, the web site is “undergoing maintainence”. I think they’ve gone bust.. do not buy from them
winedirect	GB	I ordered my wine on the 16th of…	06 January 2021	Rated 1 out of 5 stars	I ordered my wine on the 16th of December to be delivered for Christmas to Republic of Ireland. I received an email on the 21st saying it was ‘Packed’ which supposedly means Dispatched on their American system.The non delivery for Christmas was attributed to the closure of border for 48hrs. So far understandable. It is the 6th now and the wine still hasn’t been delivered. After I wrote my second email of complaint I received a response stating that they recalled all the deliveries from DPd and re sent  them and that is why the date of despatch they mentioned and the dispatch dates on DPd website were different. I would love to believe this but cannot understand why when I called on the 29th evening I wasn’t given this info.. Also there was no update given at all except for a generic missive on their website.Anyway whatever the reason for the delay this is the first and last time I use this firm. I really should have read the reviews before I ordered from them especially since these were gifts for in-laws we couldn’t see due to the travel  restrictions
winedirect	GB	Amazing easy ordering fast delivery and…	21 June 2020	Rated 5 out of 5 stars	Amazing easy ordering fast delivery and great quality wines !
winedirect	GB	You make a order but nothing arrives	07 August 2023	Rated 1 out of 5 stars	the problem with this company that I encountered was that you make a online order and had to wait ages for it to arrive, which includes several unanswered phone calls, frankly I'm going to avoid making any more orders with this company as there are so many companies out there who offer a far better service than this one, shame......
winedirect	GB	No service or support at all	02 January 2023	Rated 1 out of 5 stars	UPDATE to below review:Later that day after my review was posted, I received a call from a lady at Wine Directs, offering her sincere apologies. She could not understand why I had been waiting so long for my wine, why no messages had been returned and agreed it was not good enough. She offered to email me her personal number / email address for future contact if I needed it (although to date I have not yet received this) and promised to ship out the wine, albeit with substitutions of similar / greater value. I am relieved to say the next day, my missing 7 bottles of wine finally turned up. It doesn't really compensate for the 4 months delay of my wine, nor explain any reasons, but I am pleased to have got my wine and I appreciated the phone call and apology.---------------------------------No service or support, they do not respond to emails, messages or phone calls. Zero customer service which I rarely experience. Ordered £550 of wine January 2nd, partly delivered 4 weeks later, still awaiting remaining 6 bottles but they will not respond to my queries about when I can expect to receive them. They just ignore me and it is so frustrating. I have had to instigate a charge back claim through my credit card as they must be in breach of some contract and have had my money for almost 4 months and I have not had my wine, I am not sure I ever will! They purport to offer a great variety of wine and I do like their choices but when they cannot deliver on what they offer with absolutely no communication then I cannot trust them anymore. Shame, but very unusually for me I would say do not use them, with regret!
winedirect	BE	Fraudulent company	03 January 2020	Rated 1 out of 5 stars	Placed an order with them on 22 December - it has still not been delivered and they are not answering e-mails or phone calls.  Plan to report for fraud
winedirect	GB	Quality from product to delivery.	28 June 2020	Rated 5 out of 5 stars	
winedirect	GB	Placed and paid for my order 3 weeks…	17 March 2023	Rated 1 out of 5 stars	Placed and paid for my order 3 weeks ago. Chased them twice. One response a week ago, but still no wine.Their service has become terrible.
winedirect	GB	AVOID LIKE THE PLAGUE	10 June 2019	Rated 1 out of 5 stars	AVOID LIKE THE PLAGUEI find it disconcerting that this company has reappeared selling the same product, using the same web site URI, using the same web site frontend and backend software and images. It's interesting too that - like it's previous instance - these people are not responding to polite emails about missing wine (7 days later).What's better is that they even have my personal data on their database including the order that I made that they - sorry the previous owners - so earnestly promised but which they never delivered to me. So what has changed you might ask?Well all that I can see is that we now have (Sussex) rather than troublesome things like International or any such nonsense in the company name on Company House. Oh and there's the teeny, tiny problem that the wine that I bought for £100+ is no longer owed to me by this 'new' company even thought they have the order on their system. How nice for them?Assuming that I am not unique amongst winedirect's thousands of customers - except for the fact that I work with GDPR for a living - I will take it as my social responsibility to ask the ICO about their views on the large scale transfer and processing of peoples' personal data without transparency, consent or other lawful basis to do so. Penalties are max Euro 20M in addition to any damages that individuals raise separately. p.s. Note to the 'new' owners: I'm a mistrusting soul - being left short £100+ on an order does that to you. So I have taken evidence of my claims prior to posting this review. And given that you have been publicly informed of my intention to complain to the ICO you would now delete that data at your peril. But, of course, you might consider that a risk that you are willing to take and hope to get away with that too.
winedirect	GB	6 weeks no wine this is a Con!!!	27 July 2023	Rated 1 out of 5 stars	8 weeks no wine this is a Con!!!! Please report
winedirect	GB	Efficient and quick	22 June 2020	Rated 5 out of 5 stars	
winedirect	GB	Legends	25 June 2020	Rated 5 out of 5 stars	The best! Very professional!
winedirect	GB	Excellent product	29 October 2019	Rated 5 out of 5 stars	Excellent product, delivery and amazing knowledge.  Highly recommend.
winedirect	GB	Started the process of money recovery	31 January 2019	Rated 1 out of 5 stars	Started the process of money recovery trouble is the hundreds infront of me.!!!!
winedirect	GB	Very quick and efficient delivery	23 May 2020	Rated 5 out of 5 stars	
winedirect	GB	I placed an order with them 12 days ago…	20 February 2020	Rated 1 out of 5 stars	I placed an order with them 12 days ago and haven't heard back. Is this company still trading?
winedirect	GB	Do not order here	15 March 2023	Rated 1 out of 5 stars	Terrible communication, order arrived late and incorrectly. Would highly recommend not using their service
winedirect	GB	Excellent service as usual.	10 November 2021	Rated 5 out of 5 stars	
winedirect	GB	Good wine and good prices.	04 April 2022	Rated 5 out of 5 stars	
winedirect	GB	AVOID	16 January 2019	Rated 1 out of 5 stars	Ordered wine 20th October and it did not arrive, I have tried to call for weeks, sent on-site chat messages, query forms and emails - no response! AVOID!
winedirect	ZA	Crap service	16 January 2019	Rated 1 out of 5 stars	I have had the same experience. Ordered two cases for my daughters wedding in October and they didn’t arrive. Since then been trying contact them for a full refund. No response yet. Will now take up with Citizens Advice. Shocking service !
winedirect	ES	Very bad	14 January 2019	Rated 1 out of 5 stars	Recieved wrong product and no response from customers service at all
winedirect	GB	Thieves!	12 January 2019	Rated 1 out of 5 stars	This shower are blatant thieves plain and simple. I ordered on 21st November 2018, money taken same day, and I still haven’t received my order. My emails are ignored, Messages on their online contact form asking for updates also go ignored. If you call you only ever get an answer machine, I leave messages but never get a reply.PLEASE if anyone has similar experiences PLEASE report to Citizens Advice, they will pass claims to Trading Standards, surely if enough claims these thieves will be investigated and shut down. This company is part of the Fermentation group who own justincases.co.uk so AVOID that company too!
winedirect	NZ	Christmas present delivered 10 Jan	11 January 2019	Rated 1 out of 5 stars	We ordered on 16 Dec for a Christmas present after checking delivery times etc.  It was finally delivered 10 Jan.  In the interim I had rung multiple times (incurring int. Call costs) during posted business hours and they were always on answer phone. I left messages including order no. Saying please cancel order and refund. I also sent email through their website. My son in London also tried ringing multiple times with same result.  Will NEVER use again!
winedirect	AU	The wine I ordered and paid for on…	11 January 2019	Rated 1 out of 5 stars	The wine I ordered and paid for on 12.12.18 for my UK family’s Xmas finally arrived on 28.12.18. Too late - missed the event, family dispersed.  They delivered 6 extra bottles  - perhaps as compensation for their failure to deliver my order on time, or perhaps a mistake - we will never know because there was no note, no reply to my 4 emails, 3 website chat requests and 6 phone messages inquiring about my order.  So I’m not surprised to read some of the reviews posted in the past few days by other customers left in the lurch - it really did feel like the company was only partially functioning.  Absolutely hopeless.  Never again.
winedirect	GB	Liquidated !	10 January 2019	Rated 1 out of 5 stars	I have used Wine Direct before and this is the first time I have had a problem. My account says the wine was delivered in October when they said it would after November 5th. Since yesterday my previous orders have been wiped clean !
winedirect	GB	Avoid	10 January 2019	Rated 1 out of 5 stars	AvoidPlaced an order on 18 December and the money (£200+) was debited from my account on 19 December. Despite numerous phone calls, emails and attempts to online chat with the company, I received no response.  Thankfully the bank refunded me and are chasing the company for the money, despite paying on my debit card. Clearly this company have no intention of honouring orders. For anyone experiencing similar problems - Fermentation Limited is the company and is still showing as 'Active' on Companies House. You should be able to get your money back through your bank (depending on how you paid and specific bank's policy) by marking the transaction as disputed.
winedirect	GB	Where is my wine!?	09 January 2019	Rated 1 out of 5 stars	Same experience as others, ordered wine on 11 December 18, payment taken, no wine, no returned call or responses to emails. Can anyone advise if this company is still up and running or should I try and reclaim my payment and how do you do this?
winedirect	GB	Has Wine Direct gone bust? They don't answer phone any more	09 January 2019	Rated 1 out of 5 stars	Similar to the below review, we ordered wine from Wine Direct before Xmas (Dec 17th) no sign of it to this day (Jan 9th) they do not answer their phone, do not respond to emails, looks like we will have to take them to small claims court to get the money back. Do not order from them I think they must have gone bust ...
winedirect	GB	Regular customer who sadly will never use them again. DO NOT USE	08 January 2019	Rated 1 out of 5 stars	Having used wine direct for a number of years i have always found them to be very prompt and also incredibly helpful when i called up. However something has happened to this company. Having ordered a number of wines in November there was no sign of delivery. No one answers the phone or replies to emails. Horrendous service. I engaged my credit card company to reclaim the money spent. Much to my surprise the wine then turned up! However having selected no wine substitutions they decided to swap a £70 bottle of red wine for a £35 bottle of white wine. I have since called numerous times to get the money refunded but low and behold no replies. I have essentially paid double for a bottle of wine i had no interest in buying. I am actually very sad to say I will never use them again and urge others not to use them. Something has happened to this previously nice and reliable company. Do not use.
winedirect	AU	Great selection of wines on offer	08 January 2019	Rated 4 out of 5 stars	Great selection of wines on offer. We are based in Australia and needed to send Xmas wines to our clients in UK/Europe, and we had a specific brand we needed to send. WineDirect had it, however, I had to place another order later in the week, and the wines we were sending, then needed a minimum purchase of 6 bottles, as opposed to the single bottles I had previously ordered. This was a problem, so we needed to find an alternative online seller to send other wines/champagnes. Otherwise a great service.
winedirect	GB	Poor service!	07 January 2019	Rated 2 out of 5 stars	I placed an order with WineDirect on the 22nd December and finally received my order on the 5th Jan. I called them four times and emailed twice but literally had no response whatsoever! I was trying to ascertain when I would expect my order as I had heard nothing. Even when it was shipped they did not inform me. Therefore, I missed the delivery date/time and finally picked it up on the 7th Jan.
winedirect	GB	I ordered wine as a present costing me…WHERE IS MY WINE OR MONEY?	07 January 2019	Rated 1 out of 5 stars	I ordered wine as a present costing me nearly £100 on 16th December as a Christmas present. Still no wine and despite leaving constant messages have received no reply. Are they bankrupt??
winedirect	AU	Ordered online from Australia - all good!!	07 January 2019	Rated 5 out of 5 stars	Ordered online from Australia. Wine arrived on the day requested, correct order and very happy. Also, compared a lot of sites and this one was by far the best value for money. Has a fabulous selection of wines. Website works very well. Would absolutely use again.
winedirect	ZA	Christmas theft - bad taste all round	06 January 2019	Rated 1 out of 5 stars	Ordered and paid for wine to be delivered to my daughter in Northwood before Christmas. Payment received and confirmed AND taken from my credit card but no delivery and now she tells me the site is down. This is theft!
