site	location	review_title	review_date_original	review_rating	review_text
winedirect	GB	Would give no stars if I could	21 August 2023	Rated 1 out of 5 stars	Would give no stars if I could.  Ordered some very nice wine for my brother-in-laws 60th birthday, wine status has been pending since.  Have made numerous phone calls and online enquiries, all have been ignored.   If this company is having problems, stop taking orders and start talking to the customers whose money you have taken.  I'll be contacting my credit card company today to start a chargeback claim (as it was under £100), and I'll be contacting Trading Standards.   Biggest regret is I didn't check Trust Pilot before ordering, I will do in future for companies I've not dealt with before.
winedirect	GB	This is a scam… order wines two months…	08 August 2023	Rated 1 out of 5 stars	This is a scam… order wines two months ago. On the website still says pending. They’ve taken my money immediately after the order. Sent various emails, nor reply; called their only number which apparently is not available. Save your time and money, don’t buy from this, at best unprofessional, company.
winedirect	GB	Poor service and communication	15 September 2023	Rated 1 out of 5 stars	Poor service and communication (not answering phone or responding to email) seems to be a recurring theme. I eventually got 50% of my order that's me done with them  having been a customer for nearly 10 years. They have always had a great range of wines but for whatever reason their ability to fulfil orders and communicate with customers has gown downhill these last few years
winedirect	GB	Wish I had read the trustpilot reviews	17 September 2023	Rated 1 out of 5 stars	Wish I had read the trustpilot reviews. £155 out of pocket, no communication, no response at all to my many calls messages and emails. And more importantly NO wine. I’m not sure how to get my money back, but I will be trying ….
winedirect	GB	STAY CLEAR OF THIS COMPANY!!!	25 September 2023	Rated 1 out of 5 stars	Would give 0 stars if I could - absolute shambles of a company. Placed and paid for my wine order 24 Aug - a month later and status when I check is still 'Pending', and no one answers the phone when you call the number listed on their site, just rings and rings until it goes to voicemail! Hoping I'll be able to get my money back!
winedirect	GB	Arrived after months	18 May 2023	Rated 3 out of 5 stars	I ordered wine in May 2023. After reading reviews I had pretty much kissed goodbye to my money. No response when I sent an enquiry. However, suddenly yesterday my order status was updated to packed and it arrived today - no items missing.So, customer service terrible but I'm just grateful that I did receive it eventually
winedirect	GB	Great local wine company	01 September 2023	Rated 5 out of 5 stars	Regularly order my wine from here and always pleased with the selection available. Fast service and would definitely recommend - team there are very knowledgeable
winedirect	GB	Same experience!	19 September 2023	Rated 1 out of 5 stars	I really wish I could say something different than had already been said but sadly not. Ordered some hard to get Barolo but a month later my order remains “pending”. I did get a couple of email responses from Helen promising delivery “next week” but sadly next week never came. I even offered to visit the business as it’s only a few miles away from me but they didn’t reply to this. Not sure what’s going on with this retailer but there are clearly some significant issues. Would advise people to avoid them! I managed to get a refund from my credit card company!
winedirect	GB	No wine, no comms, no refund, no service... stay away	15 August 2023	Rated 1 out of 5 stars	Order placed 15/08/2023 for one case of wine. No communications, no estimated delivery, very frustrating. I did once get through on the phone and I was PROMISED a delivery, but it never arrived. That was two weeks ago. Now they don't answer the phone at all, ever. This company is really cheating customers. I stupidly paid by debit card, and not credit card, or I would have got the card vendor involved and claimed a refund. This company is a bunch of sharks... only buy here if you want to make a charitable donation... as you will never see your wine.
winedirect	GB	Poor Customer Service	02 August 2023	Rated 1 out of 5 stars	On 2nd August, I ordered a few bottles of nice wine for an event ten days later and spent almost £100. The order just stayed as ‘pending’. Once the event passed I requested a refund - four different times. Eventually, a nice lady called to apologise and said she would issue an immediate refund; that was three weeks ago. I have chased this again but never expect to get my money back.
winedirect	GB	Do not buy wine from these guys. Doesn't even deserve the 1 star	21 September 2023	Rated 1 out of 5 stars	doesn't even deserve the 1 star. I have waited over three months now and tried phoning several times as well as sending e-mails to no avail. This is a terrible way to treat people and what they are doing is illegal.Their site should be banned from advertising.
winedirect	AU	Appears to be plain theft	09 September 2023	Rated 1 out of 5 stars	Appears to be plain theft. I spent nearly £100 on 9th September for a very special gift for a once in a lifetime occasion. After a couple of days the link to my order update, which had read ‘pending’, led to a blank page. A huge alarm bell obviously. I have emailed, used their contact form, posted on their Facebook page, and used the email address on their Facebook page (it bounced).
winedirect	GB	Do not use!	06 September 2023	Rated 1 out of 5 stars	"Do not buy! They will ""pending"" your order and you'll never receive anything. Get your money back via contacting your bank and setting up a charge-back dispute."
winedirect	GB	Having been reassured my order would…	18 September 2023	Rated 1 out of 5 stars	Having been reassured my order would imminently arrive since the 7th of May I now realise I will never receive the goods. I have been unable to reach the company by phone to again be reassured of their struggles to meet my order. I will never do business with this company again!
winedirect	GB	Customer service has not improved.. be very careful	20 September 2023	Rated 1 out of 5 stars	My order was on 8th July.  No news or update until I started phoning.  Issues with the warehouse, then it was being brought into the country.  Promises of it being delivered never went through.  After three days just now of calling the company up to ten times throughout the day trying to reach someone (it just went to voicemail) I gave up fearing the worst and initiated a dispute via my credit card company for non-delivery hoping to get my money back.  I let the company know this yesterday by phone message and by email.  Today, unannounced, the wine has been delivered so I did eventually receive something, unlike some of the other reviews.  However it is 2022 and not 2018 as promised (ordered 2017 which became out of stock) so very little information on how it is drinking/will be drinking.  Whatever their issues are, I am not going through two months of worry again that I may have been defrauded.  I can no longer trust what I may be told by them with regard to my order.
winedirect	GB	Absolutely appalling company	14 September 2023	Rated 1 out of 5 stars	Absolutely appalling company, ordered wine on 3rd July 2023, its now the 14th of September and nothing! No updates, they dont answer the phone or written enquiries. Why are companies like this allowed to continue to trade. I plan on turning up at their premises and causing merry hell. SCAMMERS!!!! DO NOT USE THIS LOT!
winedirect	CA	Scam or just catastrophically badly organised?	29 June 2023	Rated 1 out of 5 stars	I ordered a bottle of wine on June 29th 2023 for my brother-in-law's birthday. It never arrived, though the money left my Visa account on the same day. I asked for an update on August 2nd... no reply. Repeated my request for a progress report on August 30th. Still no reply. I see from the Trustpilot site that the company changed hands in June, and hope that the new owner didn't pay too much for it, because the service sucks, as is confirmed by the fact that as of today, 53% of their reviews are one-star. I don't know if this execrable service is caused by inefficiency or dishonesty, but either way, AVOID THEM LIKE THE PLAGUE!
winedirect	GB	Excellent	19 June 2023	Rated 5 out of 5 stars	Recently read the Trustpilot reviews ,with entrapadation, there was no need ...James as just recently taken over the business ,and with all new businesses ,it takes time to iron out ALL issues ,which I am sure James will do .Upon order ,delivery was 2 weeks .A company I will be using again for there superb SA wine selection alone WELL DONE ..
winedirect	GB	Non Existent Customer Service	14 September 2023	Rated 1 out of 5 stars	Ordered some fine back in July and still has not arrived,  which can happen from time to time.  What I am finding extremely disappointing is that have left telephone messages and emailed a number of times and am yet to get a response.  What happed to good old customer service.
winedirect	GB	The wines I ordered are now available. Hope they can turn things around.	28 August 2023	Rated 3 out of 5 stars	This is an update on my previous review.The wines I ordered from this company are now available and I hope that they will be able to turn things around.
winedirect	GB	Ordered wine on August 31st and…	31 August 2023	Rated 1 out of 5 stars	Ordered wine on August 31st and confirmed with order processing but nothing since. Numerous emails and phone calls were unanswered.Have requested refund from credit card. DO NOT USE THIS FRAUDULENT website.
winedirect	GB	Similar experience to all those below	13 September 2023	Rated 1 out of 5 stars	Similar experience to all those below.  Ordered 6 bottles on 2nd June.  Only 4 arrived.  Since then no replies to e-mails and phone always goes to answerphone.  No reply to messages left.  Unsure what more can be done but this company should not be trading.
winedirect	GB	Quality wines great prices	17 August 2023	Rated 5 out of 5 stars	We received great quality wines at great prices with fast efficient delivery- thank you!
winedirect	GB	I have been waiting for a delivery…	19 September 2023	Rated 1 out of 5 stars	I have been waiting for a delivery since May 23. I have tried to call the company on a number of occasions, but never managed to speak to anyone.
winedirect	GB	Really surprised at the other reviews	20 June 2023	Rated 4 out of 5 stars	Really surprised at the other reviews. I’ve been using wine direct for a while and have only good things to say. The service has been helpful, recommending some great wines tailored to my taste and my price range and I will continue to use them for as long as my glass needs filling.
winedirect	GB	Terrible service and communication	14 July 2023	Rated 2 out of 5 stars	4 bottles ordered for a special birthday present - no communication so phoned to be told they only had 2 but would send them and get the agent to send the rest directly to me. Next day 2 bottles did arrive but a week later nothing else. Was told yesterday this would be followed up. Phoned this morning to hear recorded message saying they are closed until 24th!! Why wasn’t I told this!!  Very disappointed and angry that I now won’t  have the full order for the intended present.
winedirect	GB	Excellent	28 June 2023	Rated 5 out of 5 stars	James provided me with some brilliant advice on twelve bottles of red. Ordered yesterday and delivered today. Excellent service. Very happy. If like me, you don't know a great deal about wine, I would urge you to call the company prior to placing an order. Wine is clearly their passion, and they were very happy to offer suggestions and advice. Couldn't ask for more. Thank you very much!
winedirect	GB	Great selection of wines and accurately…	16 March 2023	Rated 3 out of 5 stars	Great selection of wines and accurately delivered at pretty good prices. However customer service is a ZERO. Takes an eternity to dispatch the goods although when dispatched they arrived within 24 hours. I ordered on 1st March and eventually they arrived on 16th. They did not answer any emails. Why does it take so long. Perhaps someone from WineDirect could provide an explanation
winedirect	GB	New ownership has made meaningful change to customer service	30 June 2023	Rated 5 out of 5 stars	I, like others, had made an order that was stuck on pending after a couple weeks with no contact. It was a large order and I was somewhat worried about it arriving on time (or at all). However after receiving an email explaining the change in ownership I rang up and spoke to a very helpful person who explained why the order was delayed and sorted out some acceptable substitutes of equal or higher quality. The order was shipped that very day and arrived the next which was exceptional, right on time for the event I was ordering for.  Everything was accounted for and some of the substitutes were actually much nicer than I had ordered, so they did right by me.  I think I am happy to say that the new ownership seems to have made real changes and that my experience afterwards was significantly different to beforehand.  Hopefully this continues.
winedirect	GB	Total shambles	08 September 2023	Rated 1 out of 5 stars	Avoid this company - absolute shambles. Ordered 6 bottles of wine in May 2023 and still no sign of it 18 weeks later. They do not answer the phone nor respond to emails. Am seeking to recover monies through section 75 Consumer Credit Act route having asked for full refund.
winedirect	GB	Great Service	29 June 2023	Rated 5 out of 5 stars	First time using this company and I would definitely recommend, very happy.Great selection of wines, delivery was prompt and arrived on the expected delivery date, as promised. Will definitely be ordering from them again.Thank you
winedirect	GB	Takes bloody ages but good selection	14 December 2022	Rated 4 out of 5 stars	Have shopped with WineDirect a few times over the past decade - sadly last iteration clearly didn't work out that well hence many negative reviews here. The new operation looks very much the same and sadly suffers from the same issue - they take ages to move forward on orders, don't update much but then deliver very swiftly as soon as the order is processed. Advice is don't buy if you need it in a hurry.
winedirect	GB	Ordered wine - No wine arrived, no contact from company	20 September 2023	Rated 1 out of 5 stars	Ordered wine, it's been a month already. No response to any email, no-one picks up the phone on any day of the week. I have reported the company to trading standards.
winedirect	IE	Received my wine after a very nice call…	25 August 2023	Rated 2 out of 5 stars	Received my wine after a very nice call from Helen plus a complimentary bottle due to delay.   Pity it took so much to get the wine moving but I understand Helen was out for a while.  Thanks Helen
winedirect	GB	Great all-around service	26 May 2019	Rated 5 out of 5 stars	Avoided this company before due to bad reviews. As it's under new ownership, thought I'd give it a try. Spoke to customer service for some wine advice, who were polite and knowledgeable. Wine arrived in good time and well packaged. And most importantly, lovely wines. Will definitely be ordering from them again.
winedirect	GB	Great service; fantastic surprise!!	12 June 2020	Rated 5 out of 5 stars	Fantastic! Not only do Wine Direct stock what is probably my favourite, sensibly priced, wine in Greywacke Wild sauvignon but as they ran out of one of the bottles I ordered I also got a surprise bottle of Dog point Section 94. Never had this before but if it drinks as well as it sounds I may well have a new favourite. One very happy customer who will definitely be returning.
winedirect	GB	WHAT A DIFFERENCE.The new owners have…	04 October 2019	Rated 5 out of 5 stars	WHAT A DIFFERENCE.The new owners have certainly turned this Company around,and customer satisfaction is now their top priority as well as selling top quality wines at fair prices.They kept me informed on the progress of my order on a daily basis either by phone or e-mails so always knew the status of my order.Will certainly be placing further orders with this Company in the future
winedirect	GB	Top Notch	31 December 2020	Rated 5 out of 5 stars	I live in deepest Aberdeenshire, about as far from Sussex as you can get. I've ordered from Wine Direct twice now and they've been faultless.  5 Stars all the way with  an excellent, broad choice of quality wines, first class customer care, friendly and helpful staff, and very speedy delivery to over 500 miles away.
winedirect	GB	Fantastic and reliable service!	04 March 2021	Rated 5 out of 5 stars	I recently ordered a special bottle of wine as a treat during this lockdown period. I called windirect.co.uk and was helped by Helen who gave fantastic service! Helen knows her wines very well and was very helpful and reassuring on timelines involved with sourcing the wine and delivery. I highly recommend contacting them when ordering  as they provide great service and have a selection of unique and special bottles of wine you can treat yourself with!!
winedirect	GB	May you prevail and prosper.	13 May 2020	Rated 5 out of 5 stars	Having made 2 purchases now with this wine merchant. I can honestly say. I've been highly delighted with the way both of my orders have been processed. Even in the  country's current situation, both orders have arrived in a reasonable timescale.It's nice to see you can track your order all the way to your door. I'm also impressed with the packaging of the products. Double boxed, Proper separators.You deserve credit.
winedirect	GB	Happy Customer !	28 April 2023	Rated 4 out of 5 stars	Unusually I read the Reviews after placing my order so my expectations were low. Happy to report that the wine arrived within 2 weeks. I chased after 10 days week and they did call back promptly including a phone call from them to ask if I was happy to have 1 bottle substituted as the one we wanted was held up in customs. After the phone call the wine arrived 24 hours later. Would use again but not if I was in a hurry.
winedirect	GB	Shipping issue + good resolution by the owner	04 April 2023	Rated 5 out of 5 stars	Experienced a delay in my order due to shipping issues, but the owner Helen gave me a call this morning to apologise and offer both a refund + goodwill voucher. Will be sure to give them another try on my next order.
winedirect	GB	Dreadful	04 September 2023	Rated 1 out of 5 stars	Dreadful. Order processed and accepted on 21 July 2023. Nothing heard by 04 September 2023 despite email reminders sent by me to WD (but no replies from WD received). Ive now asked for a refund. Fortunately I paid with a credit card. Buyer beware!!!
winedirect	GB	Quality Wines, Keen Prices, Exceptional Service	21 May 2019	Rated 5 out of 5 stars	"This is simply the best on-line wine company in the UK. The quality and range of wines is exceptional. The prices are competitive and the overall level of customer service is exceptional. I used various wines shops/brokers for various types of wine in the past - Wine Direct Sussex is now the only place to go. Weddings, Corporate gifts or weekend tipples, they do it all. Helen and the team are experts in their field, this combined with their ""customer first"" attitude will blow you away. They are  leaders in their field and set the bar for all other competitors!!!"
winedirect	GB	Not wine deals direct!	09 March 2021	Rated 5 out of 5 stars	I previously wrote a 1 star review as I had received awful service from WINE DEALS DIRECT.  My error! This company were quite rightly upset by my review as it was incorrect.  They remained professional and bless them kindly understanding and said they get this confusion often.  Such a shame that another companies bad service can have a negative effect on their business. I've since removed my 1 star review and will add it to the correct company. Wine Direct please accept my sincere apology and those reading this please learn from my silly mistake and don't get these 2 companies mixed up as they are chalk and cheese
winedirect	GB	AVOID THIS COMPANY	01 September 2023	Rated 1 out of 5 stars	Same experience as most. Made a £700 order in July. Heard nothing. After chasing by email and phone I finally got a call in mid August saying that their new system meant they weren’t receiving emails or calls. Really??  They promised to send the wine immediately. Naturally it never arrived. Have been chasing by email and phone again but no one ever picks up or responds. Will now need to take whatever action is necessary to recover my £700. Everyone should avoid this company.
winedirect	GB	Excellent and Friendly Service	07 January 2021	Rated 5 out of 5 stars	We purchased a number of gift vouchers for various clients over the Christmas/New Year period, rather than wine, which made it a complicated order.  This then needed to be changed on several occasions and Helen could not have been more helpful or understanding.  We would highly recommend Wine Direct and will certainly use them again in the future.
winedirect	GB	Good customer service.	04 December 2019	Rated 5 out of 5 stars	I think if i'd looked at trustpilot before I wouldn't have ordered but I am glad that I did. Wine arrived in less than a week from ordering. Good communication from the customer service team.There was some variation in vintages and wines (one was replaced with a more expensive one from the same producer) but as I ticked that box I can't complain. One thing to note is that many of the old vintages which are out of stock are still up on the site so if you absolutely have to have a particular vintage, it's probably worth checking first.
winedirect	GB	Thanks again Jason another job well done.	10 October 2021	Rated 5 out of 5 stars	Thanks again Jason another job well done ordered my Louis Royer VSOP cognac on Thursday morning received emails to keep me updated and received my order via Parcelforce on Saturday morning.Thanks Eddie
winedirect	GB	First time I have ordered…	24 December 2020	Rated 5 out of 5 stars	First time I have ordered from wine direct and I will be again. I contacted wines direct regarding my order and they were fantastic. The response was quick and I had the wine well before I was expecting it. That amazing under normal circumstances but during this pandemic and Brexit looming that's special. Will be ordering all my wine from wine direct from no on.
winedirect	GB	These guys really know their stuff!	04 June 2019	Rated 5 out of 5 stars	These guys really know their stuff. I was looking for a particular wine which they didn't have on their website but were able to source it for me really quickly. The previous reviews here are for the previous owners who have seemingly now left the business.Lovely people to deal with, and I would thoroughly recommend them for any wine / alcohol based query.
winedirect	GB	Dependable	23 November 2022	Rated 5 out of 5 stars	I have only used Wine Direct a couple of times, and I have only used them for wines that I had difficulty in locating elsewhere.  I found them after I placed an order with another company which simply seemed to vanish.  I have found them to be friendly and reliable, and easy to contact on the telephone.
winedirect	GB	Good service.	16 August 2019	Rated 4 out of 5 stars	Received mixed case, well packed and wines as requested. Bin ends good value, though one of the wines has signs of damp on the labels. Should have no effect on the wine. Responsive supplier with good communications. Will use again on this experience.
winedirect	GB	Great service & speedy delivery!	11 February 2021	Rated 5 out of 5 stars	I was looking online for a cheap and cheerful bottle of wine I had while on holiday, I was so happy to find it on Wine Direct. I added a nicer bottle of white later to find out that it was on backorder. The kind sales rep notified me with similar options and in the end sent me with a wine of greater value. It was such a nice treat heading into the weekend. Her service was over the top, I will definitely be reordering from them again!
winedirect	GB	Matter Resolved	11 May 2023	Rated 3 out of 5 stars	I am updating previous post. I placed an order 20/3 and received part delivery 5/4. It was difficult to get through to customer service but the matter has now been resolved very fairly and honourably by Wine Direct (Sussex) Ltd.
winedirect	GB	First time using this site	10 April 2020	Rated 5 out of 5 stars	First time using Wine Direct. Placed an order on 31.03.20. Wine arrived 08.04.20. I was pleasantly surprised as I expected a bit of a delay in the current climate. Wine was securely packaged. Ordered the Spee Wah Shiraz which is delicious. Would definitely order from Wine Direct again.
winedirect	GB	Under New Ownership	13 May 2019	Rated 4 out of 5 stars	Under New OwnershipHave not used them for a while because of the reviews from the previous owners . Tried them again only because I received a new ownership email.  I was a bit nervous but no need, wine ordered and delivered on time actually managed to speak to someone and expressed my concerns who appeared to understand how I felt and was quiet sympathetic.This site always had fabulous wines at good prices , hopefully the new companies customer service will finally be up to scratch !
